Flash Thompson,"Hey, come on, man. I just wanna talk... [as Flash gives Peter a friendly pat on the back, suddenly Peter grabs Flash by the neck and and holds him against the lockers] It feels better, right? Look, your uncle died. I'm sorry. I get it. I'm sorry. [Peter lets Flash go and begins crying] Okay? [Peter nods his head, walks off and runs into Gwen, who was watching all this]"
Gwen Stacy,"Peter. [she hugs Peter, but he just walks away] [after Peter goes looking for thief that killed his uncle, Peter encounters a thug resembles the thief but after getting into a fight with him and saving him from falling off a building Peter sees that he doesn't have the star tattoo on his wrist and lets him go, as he walks away Peter falls through the roof and lands in a Mexican wresting wring]"
Thug,"I know what you look like! You hear me! I've seen your face! [Peter looks around him and sees an old Mexican wrestling poster and decides to make himself a mask based on this and as he hones his crime-fighting skills and designs mechanical web-shooters using the industrial spider silk packets from Oscorp] [referring to Peter, who's been intercepting criminals that look like the man that killed his uncle]"
Captain Stacy,You got a description?
Police Officer,"Well, no. He wears a mask."
Captain Stacy,A mask?
Police Officer,"Yeah, and most of his victims are suspects, some of them with serious rap sheets. They're calling him a vigilante."
Captain Stacy,"Okay, he's not a vigilante. He's an anarchist. [just then Peter drops one the criminals he captured in his spider web in front of the police headquarters after this Peter then customizes a spandex suit] [in a parking lot, a car thief brakes into a car, as he's about to start the car, Peter, dressed in his Spider-Man costume interrupts him]"
Spider-Man,"Ahem, you know, in the future, if you're gonna steal cars, don't dress like a car thief, man."
Car Thief,"What, are you a cop?"
Spider-Man,"Really? You seriously think I'm a cop? Cop in a skintight red and blue suit? You know, you're...you're...you got a mind of true scholar, sir. [Peter hits him in the face with his web-shooter] [as the car thief pulls a knife on Peter]"
Car Thief,Just let me go.
Spider-Man,"Is that a knife? Is that a real knife? [Spider-Man falls on his knees, pretending to be afraid]"
Car Thief,"Yes, it's a real knife."
Spider-Man,"My weakness, it's small knives."
Car Thief,Just let me go.
Spider-Man,"Anything, but knives! [suddenly Peter shoots his web-shooter capturing the hand of the thief holding the knife] Oh, it's so simple. That was cool, man."
Car Thief,What the hell is this?
Spider-Man,Webbing that I developed myself. I don't think you really wanna know anymore right now.
Car Thief,Come on! Let me go! [Spider-Man shoots his web-shooter again capturing the thief's other hand in a web]
Spider-Man,"Okay, one second! One second! [Spider-Man pretends to sneeze and shoot another web which lands in the middle of the thief's crotch]"
Car Thief,"Come on, let me go! [Spider-Man keeps shooting web at the thief] Stop it! [Peter laughs]"
Car Thief,That isn't funny!
Spider-Man,It is kind of funny.
Car Thief,Come on! Help! Help!
Spider-Man,"Ssh! [Spider-Man shoots another web which lands on the thief's mouth, shutting him up] [as Spider-Man has the thief wrapped up in his web against the wall, he checks the thief's wrist for the star tattoo, but sees that hasn't got one] This could have gotten a lot worse. Now, hold still. [Spider-Man cuts a hole in the web across the thief's mouth so that he can breath, at that moment a cop arrives on his bike] Oh, the boys in blue are here! I got him!"
Car Thief Cop,"[as the cop arrives, he points his gun at Spider-Man] Freeze! You in the tights, don't move!"
Spider-Man,You serious?
Car Thief Cop,Who are you?
Spider-Man,No one seems to grasp the concept of the mask. [Spider-Man moves towards the cop]
Car Thief Cop,"Freeze! [the cop starts shooting at Spider-Man, which Spider-Man easily dodges and then grabs his gun]"
Spider-Man,"I just did eighty percent of your job! Huh? That's how you repay me? [when the rest of the police arrive, Spider-Man makes a run for it]"
Captain Stacy,"[to the police officer's who have failed to capture Peter] Thirty-eight of New York's finest, versus one guy in a unitard. Am I correct? [Peter turns up late at home and find his aunt waiting up for him]"
Aunt May,Where were you?
Peter Parker,I was out.
Aunt May,Did you get the eggs?
Peter Parker,Nope. Forgot the eggs! I'm gonna get it now.
Aunt May,"No, you most certainly will not! Not at this hour! [Peter turns away from his aunt] Look at me, Peter? Take off the damn hood and look at me. [Peter takes off his hood and turns to face his aunt, his face looking beat up] Where do you go? Who does this to you?"
Peter Parker,"Please go to sleep, Aunt May."
Aunt May,Please tell me.
Peter Parker,"Aunt May, please, please please go to sleep!"
Aunt May,"I can't sleep! Don't you understand? I can't sleep! [there's a moment of silence] Peter, listen to me. Secrets have a cost, they're not for free. Not now, not ever."
Dr. Curt Connors,Cross-species genetics is finally working. I've used lizard DNA to help Freddie regrow that limb.
Rajit Ratha,It's a miracle.
Dr. Curt Connors,"No, it's hard work and a promise, and it's a step closer to the primate lab."
Rajit Ratha,"Ah, but he doesn't have time for every little step."
Dr. Curt Connors,Little?
Rajit Ratha,I just mean he can't wait.
Dr. Curt Connors,"Well, he'll have to. Unless he wants to be a lab rat."
Rajit Ratha,That's not what I'm saying.
Dr. Curt Connors,So what are you saying?
Rajit Ratha,"You have to start human trials, now."
Dr. Curt Connors,"No, I don't. And no, I won't."
Rajit Ratha,"Well, then he's going to die."
Dr. Curt Connors,"People die, even Norman Osborn."
Rajit Ratha,We are not finished.
Dr. Curt Connors,Human trials? Where on earth are you gonna find the people to volunteer?
Rajit Ratha,"The wards, as far as anyone's concerned, it's for a winter flu shot. I might think that veterans hospitals a place to start."
Dr. Curt Connors,You gotta be kidding me?
Rajit Ratha,"I don't think I am. [Connors turns to leave, but Ratha stops him by holding his amputated arm] It's a little late for shock and indignation, Curt. About fifteen years late."
Dr. Curt Connors,I've no idea what you're talking about?
Rajit Ratha,"Richard Parker wore it well. On you, it's a cheap suit, as it was then."
Dr. Curt Connors,I have nothing to do with that.
Rajit Ratha,"Is that what you told his son, Peter?"
Dr. Curt Connors,I don't know what you're saying.
Rajit Ratha,"You don't know, or you don't wanna know? [after Connors has refused to do human trials on the new cross-species genetics formula] [turning to the mouse] Right, Freddie? [Ratha walks out of the Connors office] [Gwen catches Peter in the school hallway]"
Peter Parker,How's it going?
Gwen Stacy,Where are you headed?
Peter Parker,"Uh...Monday, B-track."
Gwen Stacy,It's Thursday.
Peter Parker,It's Thursday?
Gwen Stacy,What happened to your eye?
Peter Parker,Where?
Gwen Stacy,"You're eye, it looks bruised."
Peter Parker,"Oh! Yeah, yeah! I don't know. Maybe I got a rash."
Gwen Stacy,It's pretty bad. Have you gone to the nurse?
Peter Parker,Mmhmm.
Gwen Stacy,Do you like branzino? [Peter looks at her blankly] Like the fish?
Peter Parker,"Mmhmm. No, I know. I know. I know."
Gwen Stacy,"Well, if you want, you can come to this address at uh...at eight o'clock tonight. [she writes the address on a piece of paper and gives it to Peter] My mom's making Branzino, so. [Peter looks at the address] Oh, it's apartment twenty sixteen. I didn't...I didn't write that part down. I don't why I didn't. [she turns and laughs]"
Peter Parker,I'll remember it.
Gwen Stacy,"Twenty sixteen. [Gwen walks off to her class] [that evening, Peter shows up outside Gwen's bedroom window and knocks on the window] Hi! How did you get out there?"
Peter Parker,The fire escape. Your doorman's intimidating.
Gwen Stacy,That's twenty stories!
Peter Parker,"Yeah, it's alright. [Peter enters Gwen's room] This is your room?"
Gwen Stacy,"Yes, this is my room."
Peter Parker,"[Peter looks around] Books. Pictures. [Gwen laughs] Oh, hey, uh...I got your mom these. [he takes out a bunch of broken looking flowers from his backpack]"
Gwen Stacy,"Oh, lovely!"
Peter Parker,"Yeah, they're beautiful, right?"
Gwen Stacy,They're beautiful.
Peter Parker,They were...they were nice.
Gwen Stacy,"No, they're beautiful."
Peter Parker,I'm sorry.
Gwen Stacy,"No, it's impressive. They're actually held together very well."
Peter Parker,I'm gonna keep these. [Gwen smiles] [referring to Peter's backpack]
Gwen Stacy,"Do you have your suit in there? [Peter pauses, thinking she means his Spider-Man suit]"
Peter Parker,My suit? 
Gwen Stacy,"For dinner? Are you gonna...are you gonna wear that? That's um...that's [at that moment Gwen's dad, Captain Stacey, walks into her room] You must be Peter."
Gwen Stacy,"Dad, this is Peter."
Peter Parker,"Hi, nice to meet you, sir. [Peter goes to shake Captain Stacey's hand][after his argument with Ratha, Connors injects the serum into the stump of his arm, he falls asleep at his desk, and when he wakes his arm has regenerated, he tries to call Ratha]"
Dr. Curt Connors,"Emma, it's Curt. Is he there?"
Emma,"I'm afraid not, doctor. The car's taking him to the veterans hospital in Brooklyn."
Dr. Curt Connors,"No, no, no! He can't, Emma. You...you have to stop him. He...he..."
Emma,"I would, but I always lose him when he's on the bridge. I'll make sure Dr. Ratha returns your call as soon as possible. [as Connors hangs up the phone he starts to feel strange and falls, he takes a cab to catch up with Ratha, in the cab his skin starts to scale, he yells at the cab drive to drive] [at the dinner table, Peter pokes at his fish with his knife not knowing how to eat it]"
Helen Stacy,"You're having trouble there, aren't you? The head goes on the... Simon, help Gwen's friend with the fish. [as Simon starts to help him]"
Peter Parker,"Oh, uh...I got no idea"
Simon Stacy,First time. [Gwen whispers to Peter from across the table]
Gwen Stacy,Branzino.
Helen Stacy,"George, why don't you tell us about your day?"
Howard Stacy,"Oh, yeah, dad. Did you catch that spider guy yet?"
Captain Stacy,"No, we didn't catch, but we will. He's an amateur, who's assaulting civilians in the dead of night, he's clumsy, he leaves clues, bit still dangerous."
Peter Parker,"He's as...he's assaulting people? I'm not sure. I mean, I saw that video, of him and the car thief and I think most people would say that he was providing a public service."
Captain Stacy,"Most people would be wrong. If I wanted a car thief off the street, he's already be off the street."
Peter Parker,So why wasn't he then? [Gwen laughs awkwardly]
Captain Stacy,"Let me illuminate you. You see, the car thief was leading us to the people who run the entire operation. It's been a six month long sting, it's called strategy. I'm sure you're aware of the term, strategy? You've probably heard about that in school?"
Peter Parker,Yeah.
Captain Stacy,Good.
Peter Parker,"Well, obviously he didn't know you had a plan."
Captain Stacy,"You seem to know an awful lot about this case. You know something that we don't know? I mean, who's side are you on here?"
Peter Parker,"Well, I'm not on anyone's side. I saw a video on the internet..."
Captain Stacy,"Oh! You saw the video on the internet. Well, then the case is closed."
Peter Parker,"Well, no. I'm just sayin', if you watch the video, maybe send you a link? It looks like...it looks like he's really trying to help."
Captain Stacy,"Yeah, sure, on the internet he's been made out to look like some kind of masked hero or something."
Peter Parker,"No. No. I'm not saying he's a hero, I don't think he's a hero at all."
Captain Stacy,What are you trying to say?
Peter Parker,"I'm saying, he's trying to help. But it looks like he's trying to do something that maybe the police can't."
Captain Stacy,Something the police can't?
Peter Parker,I don't know.
Captain Stacy,What do you think we do all day? Think we just sit around eating donuts with our thumbs planted firmly up our asses?
Helen Stacy,George!
Gwen Stacy,Daddy.
Helen Stacy,George.
Peter Parker,I'm sorry.
Captain Stacy,Is that what you think we do down there?
Howard Stacy,"Up your what, dad?"
Helen Stacy,Howard!
Peter Parker,"I think he stands for what you stand for, sir. Protecting innocent people from bad guys."
Captain Stacy,"I stand for law and order, son. That's what I stand for, okay? I wear a badge. This guy wears a mask, like uh...you know, like uh...like an outlaw! He's hunting down a bunch of criminals that all look the same, like he's got some sort of personal vendetta. But he's not protecting innocent people. Mr. Parker."
Gwen Stacy,"Let's get some air, Peter. [she stands and turns to leave] Dad, we need to talk."
Captain Stacy,"Yes, we do."
Peter Parker,"Thank you for having me. I'm sorry if I insulted you, that was not my intention."
Captain Stacy,You're welcome. [Peter gets up]
Peter Parker,"Branzino was real good, Mrs. Stacy. Thank you."
Helen Stacy,"You're welcome. [Peter and Gwen leave the room] [after the awkward family dinner, Gwen takes Peter to the roof]"
Gwen Stacy,"Well, that was something."
Peter Parker,[referring to her dad] I'm sorry. I thought he was gonna arrest me at one point.
Gwen Stacy,"Nah, I wouldn't have let him arrest you. What happened to your face?"
Peter Parker,I wanna tell you something.
Gwen Stacy,Oh! Okay.
Peter Parker,I've been bitten.
Gwen Stacy,"So have I. [Gwen gets closer to Peter, but Peter backs off]"
Peter Parker,"Okay. Okay. Okay. Okay. I gotta tell you this one thing. I gotta tell you this one thing. It's about the vigilante and the car thief, alright? [Gwen looks disappointed]"
Gwen Stacy,Oh! Okay. [Gwen thinks that he wants to talk about her dad]
Peter Parker,"No! No! I don't wanna talk about your dad, I wanna talk about me. Okay?"
Gwen Stacy,What about you?
Peter Parker,I...I wish I could just...I can't! It's hard to say.
Gwen Stacy,Just say.
Peter Parker,No. No.
Gwen Stacy,"Say it. [Peter tries to find the right words to say to tell her the truth about himself] What? What? [he looks at her] What? [Peter shakes his head as he can't find the right words, Gwen frustrated, turns and starts to walk off but Peter stops her with his web-shooter and pulls her into his arms and as Gwen realizes who he is, Peter kisses her] [after Gwen realizes who Peter is, Peter hears police sirens and jumps off the balcony to catch up with the cop cars, Gwen sees this and says to herself] [after Peter finds The Lizard has caused havoc on the bridge, Peter tries to save a boy trapped in a car suspended from the bridge, as he frees the kid from his seatbelt the car lights on fire and Peter manages to hold onto the suspended car]"
Peter Parker,"Jack, climb, now!"
Jack,I can't!
Peter Parker,"Yes, you can! [Peter struggles to hold onto the car] Put...put it on! The mask! It's gonna make you strong. [Jack looks at Peter's mask which he'd taken off and given to him earlier] Jack, trust me. Put it on. [Jack puts on the mask] There you go! That's it! That's it, buddy! That's it. Okay, now, climb! Come on, Jack! [Jack starts to slowly climb towards Peter] Do me a favor, a little faster. Okay, bud? You're doing great, buddy. You're doing great! That's it, keep coming. Keep it coming. Keep coming. [as Jack gets closer to Peter, he reaches out his hand towards Peter, but the car suddenly drops] No! [Peter quickly catches the boy mid-fall with a web shot and pulls him to safety]"
Jack's Father,Who are you?
Peter Parker,"Spider-Man. [the day after the bridge incident, Stacy addresses the news reporters; Peter watches this on the TV as he eats breakfast]"
Captain Stacy,"At approximately 9 p.m. last night an incident took place on the Williamsburg Bridge. Much of what occurred is really speculation at this point. However, several eye witnesses to the crime as well as our own prepreliminary finding, have positively placed one individual at the scene, which is why this morning I'm issuing an arrest warrant for the masked vigilante, known as Spider-Man."
Captain Stacy,"At approximately 9 p.m. last night an incident took place on the Williamsburg Bridge. Much of what occurred is really speculation at this point. However, several eye witnesses to the crime as well as our own prepreliminary finding, have positively placed one individual at the scene, which is why this morning I'm issuing an arrest warrant for the masked vigilante, known as Spider-Man. [at school, Peter shows Gwen the spider that bit him]"
Gwen Stacy,It's so beautiful.
Peter Parker,But it's got a bite though!
Gwen Stacy,Who else knows about this?
Peter Parker,Just...
Gwen Stacy,Me? [Peter nods his head]
Peter Parker,"You don't...you don't believe what the police are saying, do you?"
Gwen Stacy,"Of course not. Does it scare you, what you can do?"
Peter Parker,No. No.
Gwen Stacy,What did that thing on the bridge look like?
Peter Parker,Real big. Too big to be human.
Gwen Stacy,You gotta lay low.
Peter Parker,"No, can't do that."
Gwen Stacy,"But you've got to. I mean, why?"
Peter Parker,"Cause of last night. Those people on the bridge, whatever is attacking them, when it killed them. So I gotta...I gotta go after it."
Gwen Stacy,But that's not your job.
Peter Parker,Maybe it is. I really liked kissing you. You're an amazing kisser. [Gwen laughs shyly]
Gwen Stacy,"Well, you know, it was...it was good for me too."
Peter Parker,Yeah?
Gwen Stacy,"Mmhmm. [as Peter leans in to kiss Gwen, he quickly catches the football that's headed towards them and throws it back into the field hitting the football post and everyone on the field watches in amazement] [Peter goes to Connors lab and finds the place looking empty, he picks up the serum injection from Connors desk and as he's looking at it Connors enters the lab]"
Dr. Curt Connors,It's not nice to snoop. I gave everyone the week off.
Peter Parker,Yeah.
Dr. Curt Connors,Shouldn't you be at school?
Peter Parker,"No, I got a...I got a free track. I wanted...I wanted to ask you a question. How would a predator track a reptile?"
Dr. Curt Connors,"Oh, they don't. Most reptiles are at the top of their respective food chain, kings of their domain."
Peter Parker,"But they gotta have vulnerabilities, right?"
Dr. Curt Connors,Why the sudden interest in the cold blooded?
Peter Parker,"Just asking a question. I got...I got...I got school stuff, biology profiles to do. So, because of the cold blood, would they react to sudden changes in temperature?"
Dr. Curt Connors,You'd have to catch one first. Did you know there's a rumor of a new species in New York? Beautiful and quite large.
Peter Parker,What do you know about it? Have you seen it?
Dr. Curt Connors,"Well, it's not yet classified. But it can be aggressive, if threatened. [suddenly Connors neck begins to show signs of changing, he turns his face from Peter]"
Peter Parker,"Doc, are you alright?"
Dr. Curt Connors,"Never been better, Peter. Never been better. Now, if you'll excuse me, I'm afraid I'm gonna have to ask you to leave. I have a new project I'm working on and I need to be alone. [he opens to door to his lab, Peter nods his head and walks out, Connors walks out with him] Don't worry, Mr. Parker. I'll be back. [he starts to walk off but before he leave he turns to face Peter] Wonderful things are coming. Wonderful things. [Peter looks at Connor suspiciously as he leaves, then Peter turns and sees the test mouse they had injected with the serum has morphed into a lizard mouse and is eating the normal mouse in the next cage] Fred! [Parker goes to Stacy's office]"
Captain Stacy,"Mr. Parker, why are you not in school?"
Peter Parker,Got a free track.
Captain Stacy,"Okay. Well I do not have a free track, so make your point quickly."
Peter Parker,"Okay, fine. There may not be a dinosaur running around Manhattan, but there is something more dangerous, and I know who it is."
Captain Stacy,You know who it is?
Peter Parker,"Dr. Curtis Connors, he's a biochemist..."
Captain Stacy,Of OsCorp?
Peter Parker,That's right.
Captain Stacy,Okay. Dr. Curtis Connors who's also my daughters mentor. Is that who you're talking about?
Peter Parker,That's the one.
Captain Stacy,"You know, recently Dr. Connors gave Gwen a glowing college recommendation. It was beautiful, when I read it I cried. But you would have me believe that in his spare time he's running around dressed up like a giant dinosaur."
Peter Parker,Not dressing up and not a dinosaur. He has transformed himself into a giant lizard. [Stacy looks at Peter like he's crazy]
Captain Stacy,Let me ask you a question. Do I look like the mayor of Tokyo to you?
Peter Parker,"I'm telling you the...I'm telling you the absolute truth. This man has worked for his whole life on cross-species genetics. He lost one arm and has been trying to grow it back, but there is something imbalanced by the equation and he has turned into a full lizard. He's using lizard DNA. He is dangerous! And he's planning something horrific. I know! I know!"
Captain Stacy,"Okay. Alright. I get it. Here's what we're gonna do. You're gonna go back to hanging out with the citizens of Tokyo, and I'm gonna go back to protecting the citizens of this fine and fair city of ours. Sergeant Butler, would you please escort Mr. Parker back to school. [Butler starts escorting Parker out]"
Peter Parker,"Captain Stacy, I'm not...I'm not messing around. Just bring him in, just call him in! You have to call him in! He is a danger to everybody! Just, please, listen to me! [Butler pushes Parker out and as Parker leaves Stacy turns to his colleague]"
Captain Stacy,"Jimmy, give me everything we have on Dr. Curtis Connors. Okay? Right away. [as Peter walks out of the police station, he notices little lizards crawling down into the sewer] [Connors has set up a mini-lab in the sewer and is recording himself on camera]"
Dr. Curt Connors,"Subject; Dr. Curtis Connors. Current temperature; eighty nine point seven, steady for forty eight hours. Blood panels reveal lymphocyte and monocyte readings consistent with subject's past. Clotting rate vastly improved, marked enhancement in...in muscle response, strength and elasticity. [as Connors is testing himself, Peter down the sewer, builds a giant web in the intersection of the tunnels; back at his sewer lab, Connors continues talking into the camera] Eye sight similarly improved. Subject no longer requires corrective lenses. This is no longer about curing ills. This is about finding perfection. In attempt to regress regenerative relapse, dosage has been increased to two hundred milligrams. [he injects himself with the serum and suddenly turns violent and knocks the camera out; we then see that Peter has set up a camera in the sewer tunnel and and lies in his web to wait for Connors] [in the sewer tunnel after Connors has transformed into a giant lizard, he finds Peter and grabs hold of him]"
The Lizard,You stopped me once. You won't stop me again! I'm getting stronger everyday! [suddenly they fall through the giant web and fight underwater with Peter escaping through a pipe that the lizard can't follow through]
Spider-Man,"Oh, that sucked! [as Peter's camera keeps taking pictures of the lizard, he notices the flash and grabs the camera, he sees that it has the label 'Property of Peter Parker']"
The Lizard,Peter Parker! [Peter goes to Gwen apartment and knocks on her bedroom window]
Gwen Stacy,"You should maybe uh...consider coming in through the lobby. [they both laugh] Also, my father is under the impression that you require psychiatric attention. [as Peter comes in through the window she notices that he's gashed across the chest from his fight with the lizard]"
Peter Parker,"Oh, really?"
Gwen Stacy,"Peter, what happened?"
Peter Parker,"You should see the other guy. The other guy, in this instance, being a giant mutant lizard. [as Peter is in Gwen's room, Gwen hears her dad calling to her]"
Captain Stacy,"Hey, Gwen. Honey, do you want uh...coco? Howard's making some coco. [she quickly goes to answer her father and Peter tries to hide]"
Captain Stacy,Okay. I just thought I remembered somebody saying last week that her fantasy was to live in a chocolate house.
Gwen Stacy,"Well, that's impractical. [she shuts her door, then opens it again] And fattening! [she shuts her door again and turns to face Peter, who smiles at her]"
Peter Parker,"Chocolate house? [she rolls her eyes at Peter then opens her door again, Stacy is still outside her door]"
Gwen Stacy,"Sorry, dad. [referring to the coco]"
Captain Stacy,It's good.
Gwen Stacy,"I just, I can't um...have coco right now, because I'm working...I'm doing this um...I have to...I have cramps."
Captain Stacy,Oh.
Gwen Stacy,"I feel kind of pukey and just sort of, I don't know, emotional. [Stacy looks awkward]"
Captain Stacy,Okay. Good. Good.
Gwen Stacy,"Like I keep crying. It's brutal. You don't wanna know, trust me. It's like, bad!"
Captain Stacy,I got it.
Gwen Stacy,"Thanks, daddy."
Captain Stacy,"Alright. [as Gwen tries to clean his chest wound, Peter tries to kiss her but she stops him]"
Gwen Stacy,I know what this is.
Peter Parker,What is it?
Gwen Stacy,"Everyday, for as long as I can remember, my father has left every morning and put a badge on his chest, and strapped a gun to his hip. And everyday, for as long as I can remember, I haven't known if he was gonna make it home."
Peter Parker,"Okay. I gotta stop him though. I have to, because I created him."
Gwen Stacy,What do you mean?
Peter Parker,"I gave him an equation that made all of this possible. Something my father had been working on, secretly. Now I realize why he kept it a secret. Gwen, this is my responsibility. I have to fix it. [back in his sewer lab, Connors has morphed back into his human form and is thinking to himself]"
