Dr. Curt Connors,"Peter Parker. Spider-Man! I'm not the one who needs help! There will be no more loneliness, no more outcasts. Species wide distribution could enhance humanity on an evolutionary scale. One has to adapt to survive. [he speaks out loud] Without changing likeness I might be free to cast off flesh wherein I dwell confide. [thinks to himself again] Would you give it all up, after all you know you can do? [he then takes the serum and injects himself with a high dosage] I can save them! [Connors starts transforming] You're not gonna get in the way of my plan, Peter Parker! [the lizard climbs into Peter's school bathroom threw the sewers, the kids all run with terror and Peter tells Gwen to run too, and then they start fighting]"
The Lizard,"No where to hide, Peter. [the lizard throws Peter through a wall and he concocts a makeshift bomb with the chemicals in the chemistry lab and throws it through the wall where Peter] [Peter throws one of his shoes at him, then Peter jumps out of the wall dressed in his Spider-Man costume and jumps on top of the lizard]"
Peter Parker,"You're not thinkin' straight, doc! Stop this! This isn't you! [as they continue to fight] Let's talk this out! [as the lizard and Peter continue to fight] Alright, so you don't wanna talk? [Peter throws a shot of web onto the lizard's mouth to shut him up] There you go. [the lizard easily gets rid of the web on his mouth, and as Peter grabs hold of his tail, the lizard tries to get Peter off his tail but hitting him hard against the wall several times] Don't...make me...have to...hurt you! [Peter then yanks his tail off and gets thrown to the ground] Ugh! Disgusting! [the lizard's tail quickly regrows back as he walks towards Peter and as he's about to tear his head off suddenly Gwen hits him with a trophy]"
The Lizard,"Gwen! [as the lizard turns to Gwen, Peter uses this opportunity to wrap the lizard in web and traps him, he then takes the trophy from Gwen and breaks the window with it, he turns to Gwen]"
Peter Parker,I'm gonna throw you out the window now.
Gwen Stacy,What? [he throws her out the window and she swings out the window holding on to one of his webs] [referring to the police sirens that can be heard outside the school grounds]
Peter Parker,"Uh-oh! Someone's been a bad lizard! [as they fight they crash through the library wall, we see a man (Stan Lee) in the library listening to music on headphones and totally unaware of the events going on behind him as Peter and the lizard keep on fighting] [after the school attack, Gwen call Peter as he's tracking the lizard in the sewer] Hey."
Peter Parker,Hey.
Gwen Stacy,Where are you?
Peter Parker,"I'm fine. I'm okay. I'm down the sewer, I'm tracking him. I gotta stop him before anyone gets hurt, but we need antidote. Do you know how to run a serum?"
Gwen Stacy,"Yeah, I do it at OsCorp all the time."
Peter Parker,"Okay. Great. Great. Great. Okay. Listen, I need you to OsCorp, I need you to access the cross-species file. It's a blue serum, vile, 1-2-3-8-9."
Gwen Stacy,"Okay, got it. On my way. [Peter finds Connors lab in the sewer and turns on his computer which has Connors recordings of himself]"
Dr. Curt Connors,"I spent my life as a scientist trying to create a world without weakness, without outcasts. I sought to create a stronger human being, but there's no such thing. Human beings are weak, pathetic, feeble minded creatures. Why be human at all when we can be so much more? Faster, stronger, smarter! This is my gift to you. [as Peter listens to Connors on the computer he looks around and finds Connors plans to use the use the old cloud machine at OsCorp to disperse a cloud of serum across the city, turning everybody into lizards] [as Stacy gets onto a helicopter to find the lizard]"
Officer,The lizard's headed toward Canal Street Station.
Captain Stacy,What about Spider-Man?
Officer,He's inside the high school.
Captain Stacy,"I want that Spider-Man off the street. [in the helicopter, Stacy listens to radio as the officer updates him]"
Officer's Voice,"The lizard creature has released a biological agent. All efforts at stopping him have failed and he is now proceeding north on 7th Avenue. [after finding out Connors plans, Peter calls Gwen]"
Peter Parker,"Hey, where are you?"
Gwen Stacy,I'm in OsCorp.
Peter Parker,"You have to get out of there right now, okay?"
Gwen Stacy,The antidote is cooking.
Peter Parker,"No, no, no! Connors is on the way. He's coming to you right now. He means to disperse them with the device, he's gonna infect the whole city!"
Gwen Stacy,There's eight minutes left.
Peter Parker,"You're gonna wait there for eight minutes after what I just told you? People are gonna die! You leave right now! Listen, that is an order! Okay?"
Gwen Stacy,I'm gonna get everybody out.
Peter Parker,"Did you hear what...? Gwen! Gwen? You mother hubbard! Are you serious?! [as Peter is rushing to OsCorp the police capture him with a stun-gun bullet and Peter falls to the ground, as they handcuff him and Stacy pulls off his mask, Peter breaks free and fights off the police officers, but Stacy pulls his gun and shouts out]"
Captain Stacy,"Freeze! Down on the ground! Put your hands behind your head! Now! [the police light shines on Peter as he's forced to turn around, revealing his face] Parker!"
Peter Parker,"It's headed to OsCorp, and you're daughter's there right now. [he slowly walks towards Stacy] You gotta let me go. [Peter kneels to pick up his mask, puts it on and runs off, the police start shooting at him]"
Captain Stacy,"Hold your fire! [as Peter is swinging away, he gets shot in the leg and slows him down as he's trying to get to OsCorp, the man whose son Peter saved on the bridge sees him struggling on the TV and organizes his construction workers to turn their cranes to form a framework on which Peter can swing to OsCorp] [Stacy arrives just as as Gwen runs out of OsCorp building with the antidote]"
Gwen Stacy,Dad! I have got to get this to Spider-Man.
Captain Stacy,"Get in the car, let's go."
Gwen Stacy,"No! No, no, no! I can stop the lizard!"
Captain Stacy,Get in the car.
Gwen Stacy,You don't understand!
Captain Stacy,"I do. You're boyfriend is a man of many masks, I get it. [he takes the antidote in Gwen's hand] Give me this. Get in the car."
Gwen Stacy,"Please make sure he's okay. [as the lizard has set up the cloud machine on top of OsCorp building to detonate the serum in two minutes, Peter shows up and they start fighting, the lizard then gets hold of Peter, smashes Peter's mechanical web slingers, rips his mask off and starts to strangle him]"
The Lizard,"Poor, Peter Parker. No mother. No father. No uncle. All alone. [suddenly they hear the sound of a shotgun cocking]"
Captain Stacy,"He's not alone! [Stacy is behind them, he shoots at a tank of liquid nitrogen, Peter then freezes the lizard to slow its regeneration while Stacy shoots it with his shotgun making the lizard fall into the tank] Hey, gift from Gwen! [Stacy gives Peter the antidote] I got this, Peter! Go! [as Peter sets off to get to the cloud machine, the lizard breaks out of the liquid nitrogen ice coating and impales Stacy with its claws] [as the lizard chases to stop Peter, Peter manages to swap the serum with the antidote, it explodes into a giant cloud over the city and hits the lizard, turning him back to his human form, as the pinnacle Peter is on breaks off from the liquid nitrogen spillage, Peter falls but he's saved by Connors grabbing him and pulling him to safety]"
Dr. Curt Connors,"The Captain! [Peter runs over to Stacy, who is gravely wounded]"
Peter Parker,Captain!
Captain Stacy,The lizard?
Peter Parker,"It's okay. We stopped him. Let's get you out of here. [Stacy winces in pain as Peter tries to move him] Look at me. You're gonna stay with me. Help's on the way, okay?"
Captain Stacy,You need to...you need to be gone when they...when they get here. Okay?
Peter Parker,I'm not going anywhere.
Captain Stacy,"I was wrong about you, Peter. The city needs you. Here. [he holds out Peter's mask] You're gonna need this. [Peter takes his mask] You're gonna make enemies, people will get hurt. Sometimes people closest to you. So I want you to promise me something, okay? [Peter nods his head] Leave Gwen out of it. Promise me that. [Peter looks down] Huh? You promise me. [Peter reluctantly nods his head]"
Peter Parker,"Yes. [Stacy closes his eyes as he dies, Peter cries and looks out at the city] [a newscaster on TV reports the aftermath of the events]"
TV Newscaster,"An eerie calm has set in over New York city. Apparently some sort of aerosolized antidote was launched from OsCorp Tower, which seems to have counteracted the biotoxins. Residents of lower Manhattan can rest peacefully, knowing that the alleged mastermind of this terror plot, Dr. Curtis Connors is behind bars. [Peter returns home to Aunt May, she's shocked to see him looking beaten and bruised, Peter pulls a carton of eggs out of his backpack and hands them to her, she hugs him]"
Aunt May,Sweetheart. It's okay. It's alright. It's alright.
Peter Parker,Rough night.
Aunt May,"It's gonna be alright. [at Stacy's funeral, Peter hides on the roof of a building nearby and watches from a distance, Gwen senses him and looks up but sees nothing, later she then turns up at his house]"
Gwen Stacy,Where have you been?
Peter Parker,"I... [he looks away not answering, Gwen starts crying]"
Gwen Stacy,"My father died. There was a funeral. They shot off rifles and they made speeches. Two of my teachers showed up, and Flash showed up. Everyone was there but you. [Peter wipes away a tear from her face, but then stops and looks away]"
Peter Parker,I can't do this. I can't do this. I'm sorry.
Gwen Stacy,What are you saying?
Peter Parker,"I can't see you anymore. I can't! [Gwen looking upset, turns starts walking away, she then stops and turns to face him]"
Gwen Stacy,"He made you promise, didn't he? To stay away from me? So I'd be safe. [Peter doesn't answer and Gwen walks off] [after Gwen leaves, Peter returns inside]"
Aunt May,What a pretty girl.
Peter Parker,Yeah. That's what Uncle Ben said.
Aunt May,Did you ask her out? [Peter shakes his head] Why?
Peter Parker,I can't.
Aunt May,Why?
Peter Parker,I'm just no good for her.
Aunt May,"Peter Parker, if there's one thing you are, it's good. Anyone has a problem with that can talk to me. [Peter listens to the voice message that his uncle left him before he died]"
Uncle Ben,"Peter, I know things have been difficult lately. And I'm sorry about that. I think I know what you're feeling. Ever since you were a little boy, you've been living with so many unresolved things. Well, take it from old man, those things send us down a road, they make us who we are. And if anyone's destined for greatness, it's you, son. You owe the world your gifts. You just have to figure out how to use them, and know that wherever they take you, we'll always be here. So, come on home, Peter. You're my hero, and I love you. [last lines; back at school, Peter and Flash have become friends, but Gwen is shunning him, Peter then shows up late to his English class]"
Miss Ritter,"Mr. Parker, tardy again. [Peter walks past Gwen and sits behind her] Well, at least we can always count on you."
Peter Parker,"Sorry, Miss Ritter. It won't happen again, I promise."
Miss Ritter,"Don't make promises you can't keep, Mr. Parker. [Peter whispers so that Gwen can hear]"
Peter Parker,"Yeah, but those are the best kind. [on hearing this Gwen smiles to herself, then we see final shot of Peter launching himself off a crane as he protects the city] [lines during mid-credits; we see Connors being escorted into his jail cell, a man in the shadows is waiting for him]"
Man in the Shadows,"Hello, doctor. Did you tell the boy?"
Dr. Curt Connors,Tell him what?
Man in the Shadows,Did you tell the boy the truth about his father?
Dr. Curt Connors,No.
Man in the Shadows,"Well, that's very good. So we'll let him be for now."
Dr. Curt Connors,You should leave him alone!
